{
  "$schema": "https://github.com/kigster/openlanes/blob/main/schemas/plan-state.schema.json",
  "version": 1,
  "plan": {
    "ordinal": "002.00",
    "slug": "implement-zeitwerk-loading"
  },
  "state": "ready_for_review",
  "updated_at": "2026-10-14T12:03:18-07:00",
  "stages": [
    {
      "agent": "yoda-writer",
      "round": 1,
      "status": "Completed",
      "from": "product_blocked",
      "started_at": "2026-10-13T19:07:45-07:00",
      "run": {
        "pid": 83139,
        "host": "macbook-m3-kig.re1.re"
      },
      "adapter": "claude",
      "model": "sonnet",
      "effort": "medium",
      "note": "completed - 4 tool calls",
      "finished_at": "2026-10-13T19:08:28-07:00",
      "to": "ready_for_planning",
      "up": 242902,
      "down": 5363,
      "seconds": 42.2
    },
    {
      "agent": "palpatine-planner",
      "round": 1,
      "status": "Blocked",
      "from": "ready_for_planning",
      "started_at": "2026-10-13T19:08:28-07:00",
      "run": {
        "pid": 83139,
        "host": "macbook-m3-kig.re1.re"
      },
      "adapter": "claude",
      "model": "opus",
      "effort": "high",
      "to": "blocked",
      "finished_at": "2026-10-13T19:09:34-07:00",
      "up": 541816,
      "down": 6565,
      "seconds": 65.4,
      "note": "blocked; see blocked.md"
    }
  ],
  "signatures": [
    {
      "at": "2026-10-13T18:59:39-07:00",
      "agent": "yoda-writer",
      "status": "Started",
      "round": 1
    },
    {
      "at": "2026-10-13T19:04:43-07:00",
      "agent": "yoda-writer",
      "status": "Started",
      "round": 1
    },
    {
      "at": "2026-10-13T19:04:57-07:00",
      "agent": "yoda-writer",
      "status": "Blocked",
      "round": 1,
      "note": "product"
    },
    {
      "at": "2026-10-13T19:07:08-07:00",
      "agent": "lando-broker",
      "status": "Started",
      "round": 1
    },
    {
      "at": "2026-10-13T19:07:43-07:00",
      "agent": "lando-broker",
      "status": "Completed",
      "round": 1
    },
    {
      "at": "2026-10-13T19:07:50-07:00",
      "agent": "yoda-writer",
      "status": "Started",
      "round": 1
    },
    {
      "at": "2026-10-13T19:08:24-07:00",
      "agent": "yoda-writer",
      "status": "Completed",
      "round": 1,
      "next": "palpatine-planner"
    },
    {
      "at": "2026-10-13T19:08:33-07:00",
      "agent": "palpatine-planner",
      "status": "Started",
      "round": 1
    },
    {
      "at": "2026-10-13T19:09:25-07:00",
      "agent": "palpatine-planner",
      "status": "Blocked",
      "round": 1,
      "note": "technical"
    },
    {
      "at": "2026-10-13T19:22:10-07:00",
      "agent": "lando-broker",
      "status": "Started",
      "round": 1
    },
    {
      "at": "2026-10-13T19:22:14-07:00",
      "agent": "lando-broker",
      "status": "Blocked",
      "round": 1
    },
    {
      "at": "2026-10-14T11:47:17-07:00",
      "agent": "palpatine-planner",
      "status": "Started",
      "round": 2
    },
    {
      "at": "2026-10-14T11:49:54-07:00",
      "agent": "palpatine-planner",
      "status": "Completed",
      "round": 2,
      "next": "luke-backend"
    },
    {
      "at": "2026-10-14T11:50:07-07:00",
      "agent": "luke-backend",
      "status": "Started",
      "round": 1
    },
    {
      "at": "2026-10-14T12:02:48-07:00",
      "agent": "luke-backend",
      "status": "Completed",
      "round": 1
    }
  ],
  "messages": []
}
