{
  "$schema": "https://github.com/kigster/agentilda/blob/main/schemas/plan-state.schema.json",
  "version": 1,
  "plan": {
    "ordinal": "005.00",
    "slug": "review-state-labels"
  },
  "state": "building",
  "updated_at": "2026-10-13T19:22:25-07:00",
  "stages": [
    {
      "agent": "leah-researcher",
      "round": 1,
      "status": "Completed",
      "from": "new",
      "started_at": "2026-10-13T19:04:38-07:00",
      "run": {
        "pid": 83139,
        "host": "macbook-m3-kig.re1.re"
      },
      "adapter": "claude",
      "model": "haiku",
      "effort": "medium",
      "note": "completed - 20 tool calls",
      "finished_at": "2026-10-13T19:07:04-07:00",
      "to": "researched",
      "up": 1348202,
      "down": 25739,
      "seconds": 145.5
    },
    {
      "agent": "yoda-writer",
      "round": 1,
      "status": "Completed",
      "from": "researched",
      "started_at": "2026-10-13T19:07:04-07:00",
      "run": {
        "pid": 83139,
        "host": "macbook-m3-kig.re1.re"
      },
      "adapter": "claude",
      "model": "sonnet",
      "effort": "medium",
      "to": "ready_for_planning",
      "finished_at": "2026-10-13T19:08:01-07:00",
      "up": 288563,
      "down": 8383,
      "seconds": 56.6,
      "note": "completed - 5 tool calls"
    },
    {
      "agent": "palpatine-planner",
      "round": 1,
      "status": "Completed",
      "from": "ready_for_planning",
      "started_at": "2026-10-13T19:08:02-07:00",
      "run": {
        "pid": 83139,
        "host": "macbook-m3-kig.re1.re"
      },
      "adapter": "claude",
      "model": "opus",
      "effort": "high",
      "to": "planned",
      "finished_at": "2026-10-13T19:10:28-07:00",
      "up": 810390,
      "down": 16376,
      "seconds": 145.7,
      "note": "completed - 16 tool calls"
    },
    {
      "agent": "luke-backend",
      "round": 1,
      "status": "Almost completed",
      "from": "planned",
      "started_at": "2026-10-13T19:10:59-07:00",
      "run": {
        "pid": 83139,
        "host": "macbook-m3-kig.re1.re"
      },
      "adapter": "claude",
      "model": "opus",
      "effort": "high",
      "to": "building",
      "finished_at": "2026-10-13T19:22:25-07:00",
      "up": 5927905,
      "down": 48489,
      "seconds": 685.3,
      "note": "Almost completed; no rounds left"
    },
    {
      "agent": "rey-frontend",
      "round": 1,
      "status": "Completed",
      "from": "building",
      "started_at": "2026-10-13T19:11:26-07:00",
      "run": {
        "pid": 83139,
        "host": "macbook-m3-kig.re1.re"
      },
      "adapter": "claude",
      "model": "sonnet",
      "effort": "medium",
      "to": "building",
      "finished_at": "2026-10-13T19:16:14-07:00",
      "up": 1112017,
      "down": 10728,
      "seconds": 287.3,
      "note": "completed - 17 tool calls"
    }
  ],
  "signatures": [
    {
      "at": "2026-10-13T18:59:38-07:00",
      "agent": "leah-researcher",
      "status": "Started",
      "round": 1
    },
    {
      "at": "2026-10-13T19:04:44-07:00",
      "agent": "leah-researcher",
      "status": "Started",
      "round": 1
    },
    {
      "at": "2026-10-13T19:06:57-07:00",
      "agent": "leah-researcher",
      "status": "Completed",
      "round": 1,
      "next": "yoda-writer"
    },
    {
      "at": "2026-10-13T19:07:09-07:00",
      "agent": "yoda-writer",
      "status": "Started",
      "round": 1
    },
    {
      "at": "2026-10-13T19:07:56-07:00",
      "agent": "yoda-writer",
      "status": "Completed",
      "round": 1,
      "next": "palpatine-planner"
    },
    {
      "at": "2026-10-13T19:08:07-07:00",
      "agent": "palpatine-planner",
      "status": "Started",
      "round": 1
    },
    {
      "at": "2026-10-13T19:10:15-07:00",
      "agent": "palpatine-planner",
      "status": "Completed",
      "round": 1,
      "next": "luke-backend"
    },
    {
      "at": "2026-10-13T19:11:04-07:00",
      "agent": "luke-backend",
      "status": "Started",
      "round": 1
    },
    {
      "at": "2026-10-13T19:11:31-07:00",
      "agent": "rey-frontend",
      "status": "Started",
      "round": 1
    },
    {
      "at": "2026-10-13T19:16:09-07:00",
      "agent": "rey-frontend",
      "status": "Completed",
      "round": 1
    },
    {
      "at": "2026-10-13T19:22:12-07:00",
      "agent": "luke-backend",
      "status": "Almost completed",
      "round": 1
    }
  ],
  "messages": [
    {
      "number": 1,
      "at": "2026-10-13T19:12:13-07:00",
      "from": "luke-backend",
      "to": "rey-frontend",
      "body": "Contract written: implementation-plan.md. ReviewLabel (B1) and Vcs.review/Review::Result (B3) shapes are fixed there; building B1-B3 now."
    },
    {
      "number": 2,
      "at": "2026-10-13T19:15:02-07:00",
      "from": "luke-backend",
      "to": "rey-frontend",
      "body": "B1-B3 landed: Plans::ReviewLabel (ALL, names, fetch, passing, INITIAL, REJECTED), Vcs.review(github:) -> Review#call(pr:, label:, dry_run:) -> Result as in implementation-plan.md (refused?/dry_run? predicates exist). Rubocop flags Naming/MethodParameterName on pr: in your cli/review/review.rb:30; I used an inline disable with a reason in vcs/review.rb. waiting_on (B6) not landed yet: assume [] default."
    },
    {
      "number": 3,
      "at": "2026-10-13T19:15:21-07:00",
      "from": "luke-backend",
      "to": "rey-frontend",
      "body": "FYI: whole suite failed to load (CLI::Review resolved to a Module): lib/openlanes/cli/review was not collapsed in Zeitwerk. I added loader.collapse for openlanes/cli/review in lib/openlanes.rb; don't add it twice."
    },
    {
      "number": 4,
      "at": "2026-10-13T19:16:09-07:00",
      "from": "rey-frontend",
      "to": "luke-backend",
      "body": "Front end done. Tests: spec/openlanes/cli/review_spec.rb (transition, CI-red refusal exit 1, dry-run footer, unknown label exit 64, gh error exit 69, help lists labels); reporter_spec.rb 'waiting on a human'; help_spec.rb review row. Notes: (1) I touched lib/openlanes.rb to collapse cli/review (Zeitwerk needs it). (2) Reporter.new(tree:, waiting_on: {'018.01' => [12]}) takes a plan-number => PR-numbers hash; please pass the board snapshot's waiting_on into Presentation.reporter where you wire it. (3) Full suite: 2267 examples, 1 failure, yours: spec/openlanes/execution/executor_spec.rb:380 (hansolo may-review, after the hansolo-reviewer.md change). Rubocop 0 offenses."
    },
    {
      "number": 5,
      "at": "2026-10-13T19:22:11-07:00",
      "from": "luke-backend",
      "to": "rey-frontend",
      "body": "Back end partly done: B1-B5 and Engine::PrWatch landed; suite 2281/0, rubocop 0. Dispatcher wiring for B6 (waiting_on into Reporter) and I1 are NOT done; carried to next round. Thanks for the collapse line, we both added it, only one copy is in lib/openlanes.rb."
    },
    {
      "number": 6,
      "at": "2026-10-13T19:22:12-07:00",
      "from": "luke-backend",
      "to": "luke-backend",
      "body": "RESUME: B1-B5 done and green. B6: lib/openlanes/engine/pr_watch.rb + spec done. Remaining: wire PrWatch into Dispatcher#tick (start only, merge.by human via support/config.rb), fire rejected/approved->deployed/discarded events, mail luke+rey with comments, record Publication#label_error in publish_for_review note, waiting_on in board snapshot -> Reporter(waiting_on:). Then I1 spec/integration/review_labels_spec.rb + spec/support/fake_gh. See implementation-plan.md Status."
    }
  ]
}
