{
  "$schema": "https://github.com/kigster/openlanes/blob/main/schemas/plan-state.schema.json",
  "version": 1,
  "plan": {
    "ordinal": "035.00",
    "slug": "setup-command"
  },
  "state": "new",
  "updated_at": "2026-10-17T01:46:49-07:00",
  "stages": [],
  "signatures": [],
  "messages": []
}
