{
  "$schema": "https://github.com/kigster/openlanes/blob/main/schemas/plan-state.schema.json",
  "version": 1,
  "plan": {
    "ordinal": "007.00",
    "slug": "plan-folder-naming"
  },
  "state": "new",
  "updated_at": "2026-10-13T17:49:44-07:00",
  "stages": [],
  "signatures": [],
  "messages": []
}
