{
  "$schema": "https://github.com/kigster/openlanes/blob/main/schemas/plan-state.schema.json",
  "version": 1,
  "plan": {
    "ordinal": "009.00",
    "slug": "plan-aging-and-bombs"
  },
  "state": "building",
  "updated_at": "2026-10-15T01:39:55-07:00",
  "stages": [
    {
      "agent": "leah-researcher",
      "round": 1,
      "status": "Completed",
      "from": "new",
      "started_at": "2026-10-13T19:07:25-07:00",
      "run": {
        "pid": 83139,
        "host": "macbook-m3-kig.re1.re"
      },
      "adapter": "claude",
      "model": "haiku",
      "effort": "medium",
      "note": "completed - 60 tool calls",
      "finished_at": "2026-10-13T19:09:25-07:00",
      "to": "researched",
      "up": 369721,
      "down": 6840,
      "seconds": 120.0
    },
    {
      "agent": "yoda-writer",
      "round": 1,
      "status": "Completed",
      "from": "researched",
      "started_at": "2026-10-13T19:09:34-07:00",
      "run": {
        "pid": 83139,
        "host": "macbook-m3-kig.re1.re"
      },
      "adapter": "claude",
      "model": "sonnet",
      "effort": "medium",
      "to": "ready_for_planning",
      "finished_at": "2026-10-13T19:10:17-07:00",
      "up": 279026,
      "down": 5099,
      "seconds": 42.1,
      "note": "completed - 6 tool calls"
    },
    {
      "agent": "palpatine-planner",
      "round": 1,
      "status": "Completed",
      "from": "ready_for_planning",
      "started_at": "2026-10-13T19:10:17-07:00",
      "run": {
        "pid": 83139,
        "host": "macbook-m3-kig.re1.re"
      },
      "adapter": "claude",
      "model": "opus",
      "effort": "high",
      "to": "planned",
      "finished_at": "2026-10-13T19:12:12-07:00",
      "up": 536783,
      "down": 13038,
      "seconds": 114.4,
      "note": "completed - 12 tool calls"
    },
    {
      "agent": "luke-backend",
      "round": 1,
      "status": "Blocked",
      "from": "planned",
      "started_at": "2026-10-13T19:17:51-07:00",
      "run": {
        "pid": 83139,
        "host": "macbook-m3-kig.re1.re"
      },
      "adapter": "claude",
      "model": "opus",
      "effort": "high",
      "to": "blocked",
      "finished_at": "2026-10-13T19:22:28-07:00",
      "up": 1922706,
      "down": 16791,
      "seconds": 276.0,
      "note": "ledger says Blocked but "
    }
  ],
  "signatures": [
    {
      "at": "2026-10-13T18:59:39-07:00",
      "agent": "leah-researcher",
      "status": "Started",
      "round": 1
    },
    {
      "at": "2026-10-13T19:07:30-07:00",
      "agent": "leah-researcher",
      "status": "Started",
      "round": 1
    },
    {
      "at": "2026-10-13T19:09:21-07:00",
      "agent": "leah-researcher",
      "status": "Completed",
      "round": 1,
      "next": "yoda-writer"
    },
    {
      "at": "2026-10-13T19:09:41-07:00",
      "agent": "yoda-writer",
      "status": "Started",
      "round": 1
    },
    {
      "at": "2026-10-13T19:10:13-07:00",
      "agent": "yoda-writer",
      "status": "Completed",
      "round": 1,
      "next": "palpatine-planner"
    },
    {
      "at": "2026-10-13T19:10:22-07:00",
      "agent": "palpatine-planner",
      "status": "Started",
      "round": 1
    },
    {
      "at": "2026-10-13T19:12:01-07:00",
      "agent": "palpatine-planner",
      "status": "Completed",
      "round": 1,
      "next": "luke-backend"
    },
    {
      "at": "2026-10-13T19:17:57-07:00",
      "agent": "luke-backend",
      "status": "Started",
      "round": 1
    },
    {
      "at": "2026-10-13T19:22:10-07:00",
      "agent": "luke-backend",
      "status": "Blocked",
      "round": 1,
      "note": "technical"
    },
    {
      "at": "2026-10-15T01:39:55-07:00",
      "agent": "lando-broker",
      "status": "Completed",
      "round": 1
    },
    {
      "at": "2026-10-15T01:39:55-07:00",
      "agent": "palpatine-planner",
      "status": "Completed",
      "round": 2,
      "next": "luke-backend"
    }
  ],
  "messages": [
    {
      "number": 1,
      "at": "2026-10-13T19:22:07-07:00",
      "from": "luke-backend",
      "to": "rey-frontend",
      "body": "Contract is in implementation-plan.md (payloads + snapshot 'bombs' field, unchanged from plan.md; bombs is always present, [] when none). B1 (💣 state) and B2 (aging_since) are built and green. B3-B7 are blocked on plan 008 (no dependents index); I signed Blocked (technical), see blocked.md B1. The snapshot 'bombs' field and the three command kinds do not exist server-side yet, so build F1 against the contract only."
    }
  ]
}
