{
  "$schema": "https://github.com/kigster/openlanes/blob/main/schemas/plan-state.schema.json",
  "version": 1,
  "plan": {
    "ordinal": "030.00",
    "slug": "review-verdict-labels"
  },
  "state": "new",
  "updated_at": "2026-10-16T23:33:06-07:00",
  "stages": [],
  "signatures": [],
  "messages": []
}
