{
  "$schema": "https://github.com/kigster/openlanes/blob/main/schemas/plan-state.schema.json",
  "version": 1,
  "plan": {
    "ordinal": "026.00",
    "slug": "one-block-at-a-time"
  },
  "state": "new",
  "updated_at": "2026-10-16T23:33:03-07:00",
  "stages": [],
  "signatures": [],
  "messages": []
}
