{
  "$schema": "https://github.com/kigster/openlanes/blob/main/schemas/plan-state.schema.json",
  "version": 1,
  "plan": {
    "ordinal": "022.00",
    "slug": "redis-outage-resilience"
  },
  "state": "new",
  "updated_at": "2026-10-16T17:54:18-07:00",
  "stages": [],
  "signatures": [],
  "messages": []
}
