{
  "$schema": "https://github.com/kigster/openlanes/blob/main/schemas/plan-state.schema.json",
  "version": 1,
  "plan": {
    "ordinal": "006.00",
    "slug": "chat-between-machines"
  },
  "state": "building",
  "updated_at": "2026-10-14T10:45:53-07:00",
  "stages": [
    {
      "agent": "leah-researcher",
      "round": 1,
      "status": "Blocked",
      "from": "new",
      "started_at": "2026-10-13T19:04:39-07:00",
      "run": {
        "pid": 83139,
        "host": "macbook-m3-kig.re1.re"
      },
      "adapter": "claude",
      "model": "haiku",
      "effort": "medium",
      "note": "blocked; see blocked.md",
      "finished_at": "2026-10-13T19:07:25-07:00",
      "to": "product_blocked",
      "up": 868089,
      "down": 10707,
      "seconds": 165.8
    },
    {
      "agent": "yoda-writer",
      "round": 1,
      "status": "Completed",
      "from": "researched",
      "started_at": "2026-10-13T19:08:12-07:00",
      "run": {
        "pid": 83139,
        "host": "macbook-m3-kig.re1.re"
      },
      "adapter": "claude",
      "model": "sonnet",
      "effort": "medium",
      "to": "ready_for_planning",
      "finished_at": "2026-10-13T19:09:00-07:00",
      "up": 238535,
      "down": 5812,
      "seconds": 48.0,
      "note": "completed - 4 tool calls"
    },
    {
      "agent": "palpatine-planner",
      "round": 1,
      "status": "Completed",
      "from": "ready_for_planning",
      "started_at": "2026-10-13T19:09:00-07:00",
      "run": {
        "pid": 83139,
        "host": "macbook-m3-kig.re1.re"
      },
      "adapter": "claude",
      "model": "opus",
      "effort": "high",
      "to": "planned",
      "finished_at": "2026-10-13T19:10:59-07:00",
      "up": 833366,
      "down": 12956,
      "seconds": 117.3,
      "note": "completed - 15 tool calls"
    },
    {
      "agent": "luke-backend",
      "round": 1,
      "status": "Started",
      "from": "planned",
      "started_at": "2026-10-13T19:11:47-07:00",
      "run": {
        "pid": 83139,
        "host": "macbook-m3-kig.re1.re"
      },
      "adapter": "claude",
      "model": "opus",
      "effort": "high"
    },
    {
      "agent": "rey-frontend",
      "round": 1,
      "status": "Blocked",
      "from": "building",
      "started_at": "2026-10-13T19:12:13-07:00",
      "run": {
        "pid": 83139,
        "host": "macbook-m3-kig.re1.re"
      },
      "adapter": "claude",
      "model": "sonnet",
      "effort": "medium",
      "to": "blocked",
      "finished_at": "2026-10-13T19:13:36-07:00",
      "up": 689147,
      "down": 5637,
      "seconds": 82.3,
      "note": "blocked; see blocked.md"
    }
  ],
  "signatures": [
    {
      "at": "2026-10-13T18:59:38-07:00",
      "agent": "leah-researcher",
      "status": "Started",
      "round": 1
    },
    {
      "at": "2026-10-13T19:04:43-07:00",
      "agent": "leah-researcher",
      "status": "Started",
      "round": 1
    },
    {
      "at": "2026-10-13T19:07:16-07:00",
      "agent": "leah-researcher",
      "status": "Blocked",
      "round": 1,
      "note": "product"
    },
    {
      "at": "2026-10-13T19:07:44-07:00",
      "agent": "lando-broker",
      "status": "Started",
      "round": 1
    },
    {
      "at": "2026-10-13T19:08:04-07:00",
      "agent": "lando-broker",
      "status": "Completed",
      "round": 1
    },
    {
      "at": "2026-10-13T19:08:16-07:00",
      "agent": "yoda-writer",
      "status": "Started",
      "round": 1
    },
    {
      "at": "2026-10-13T19:08:52-07:00",
      "agent": "yoda-writer",
      "status": "Completed",
      "round": 1,
      "next": "palpatine-planner"
    },
    {
      "at": "2026-10-13T19:09:05-07:00",
      "agent": "palpatine-planner",
      "status": "Started",
      "round": 1
    },
    {
      "at": "2026-10-13T19:10:47-07:00",
      "agent": "palpatine-planner",
      "status": "Completed",
      "round": 1,
      "next": "luke-backend"
    },
    {
      "at": "2026-10-13T19:11:52-07:00",
      "agent": "luke-backend",
      "status": "Started",
      "round": 1
    },
    {
      "at": "2026-10-13T19:12:17-07:00",
      "agent": "rey-frontend",
      "status": "Started",
      "round": 1
    },
    {
      "at": "2026-10-13T19:13:30-07:00",
      "agent": "rey-frontend",
      "status": "Blocked",
      "round": 1,
      "note": "technical"
    },
    {
      "at": "2026-10-13T19:17:36-07:00",
      "agent": "luke-backend",
      "status": "Completed",
      "round": 1
    },
    {
      "at": "2026-10-14T10:45:53-07:00",
      "agent": "lando-broker",
      "status": "Started",
      "round": 2
    },
    {
      "at": "2026-10-14T10:45:53-07:00",
      "agent": "lando-broker",
      "status": "Completed",
      "round": 2
    }
  ],
  "messages": [
    {
      "number": 1,
      "at": "2026-10-13T19:13:30-07:00",
      "from": "rey-frontend",
      "to": "luke-backend",
      "body": "F1/F2 verified green (web-test 289 pass, coverage >95%). I1 blocked: demo has no real second machine (target! refuses self-invite; pretend machine has no listener). Need a second demo process with its own node id on another port, started by just web-e2e, or tell me otherwise. Details in blocked.md B1. I only added the 403 no-token test to chat.cy.ts."
    },
    {
      "number": 2,
      "at": "2026-10-13T19:15:18-07:00",
      "from": "luke-backend",
      "to": "rey-frontend",
      "body": "Back end done: B1 contract.md in the plan folder (success is 202, not 200), B2 isolation specs, B3 subscriber degrade. Amended: GET /api/chat now has 'unavailable': null | reason string, set while Redis refuses the subscription; show chat as unavailable when non-null. On your B1: I agree with option 1. Demo already uses real Redis (db 14), so a second 'openlanes web --demo' on another port works, but needs a flag for a distinct node id and that node's snapshot on the board so machine_label accepts it. That is lib/ + justfile work for me next round once a human picks the option."
    }
  ]
}
