{
  "$schema": "https://github.com/kigster/agentilda/blob/main/schemas/plan-state.schema.json",
  "version": 1,
  "plan": {
    "ordinal": "004.00",
    "slug": "web-control-room"
  },
  "state": "building",
  "updated_at": "2026-10-13T19:22:34-07:00",
  "stages": [
    {
      "agent": "leah-researcher",
      "round": 1,
      "status": "Completed",
      "from": "new",
      "started_at": "2026-10-13T19:04:38-07:00",
      "run": {
        "pid": 83139,
        "host": "macbook-m3-kig.re1.re"
      },
      "adapter": "claude",
      "model": "haiku",
      "effort": "medium",
      "note": "completed - 16 tool calls",
      "finished_at": "2026-10-13T19:06:51-07:00",
      "to": "researched",
      "up": 1224766,
      "down": 18067,
      "seconds": 131.4
    },
    {
      "agent": "yoda-writer",
      "round": 1,
      "status": "Completed",
      "from": "researched",
      "started_at": "2026-10-13T19:06:51-07:00",
      "run": {
        "pid": 83139,
        "host": "macbook-m3-kig.re1.re"
      },
      "adapter": "claude",
      "model": "sonnet",
      "effort": "medium",
      "to": "ready_for_planning",
      "finished_at": "2026-10-13T19:07:45-07:00",
      "up": 334559,
      "down": 6825,
      "seconds": 54.0,
      "note": "completed - 6 tool calls"
    },
    {
      "agent": "palpatine-planner",
      "round": 1,
      "status": "Completed",
      "from": "ready_for_planning",
      "started_at": "2026-10-13T19:07:49-07:00",
      "run": {
        "pid": 83139,
        "host": "macbook-m3-kig.re1.re"
      },
      "adapter": "claude",
      "model": "opus",
      "effort": "high",
      "to": "planned",
      "finished_at": "2026-10-13T19:10:23-07:00",
      "up": 696894,
      "down": 14787,
      "seconds": 153.5,
      "note": "completed - 16 tool calls"
    },
    {
      "agent": "luke-backend",
      "round": 1,
      "status": "Almost completed",
      "from": "planned",
      "started_at": "2026-10-13T19:10:26-07:00",
      "run": {
        "pid": 83139,
        "host": "macbook-m3-kig.re1.re"
      },
      "adapter": "claude",
      "model": "opus",
      "effort": "high",
      "to": "building",
      "finished_at": "2026-10-13T19:22:34-07:00",
      "up": 4589417,
      "down": 37052,
      "seconds": 727.8,
      "note": "Almost completed; no rounds left"
    },
    {
      "agent": "rey-frontend",
      "round": 1,
      "status": "Completed",
      "from": "building",
      "started_at": "2026-10-13T19:10:28-07:00",
      "run": {
        "pid": 83139,
        "host": "macbook-m3-kig.re1.re"
      },
      "adapter": "claude",
      "model": "sonnet",
      "effort": "medium",
      "to": "building",
      "finished_at": "2026-10-13T19:21:15-07:00",
      "up": 3724888,
      "down": 28242,
      "seconds": 646.1,
      "note": "completed - 42 tool calls"
    }
  ],
  "signatures": [
    {
      "at": "2026-10-13T18:59:39-07:00",
      "agent": "leah-researcher",
      "status": "Started",
      "round": 1
    },
    {
      "at": "2026-10-13T19:04:44-07:00",
      "agent": "leah-researcher",
      "status": "Started",
      "round": 1
    },
    {
      "at": "2026-10-13T19:06:46-07:00",
      "agent": "leah-researcher",
      "status": "Completed",
      "round": 1,
      "next": "yoda-writer"
    },
    {
      "at": "2026-10-13T19:06:55-07:00",
      "agent": "yoda-writer",
      "status": "Started",
      "round": 1
    },
    {
      "at": "2026-10-13T19:07:40-07:00",
      "agent": "yoda-writer",
      "status": "Completed",
      "round": 1,
      "next": "palpatine-planner"
    },
    {
      "at": "2026-10-13T19:07:57-07:00",
      "agent": "palpatine-planner",
      "status": "Started",
      "round": 1
    },
    {
      "at": "2026-10-13T19:10:11-07:00",
      "agent": "palpatine-planner",
      "status": "Completed",
      "round": 1,
      "next": "luke-backend"
    },
    {
      "at": "2026-10-13T19:10:32-07:00",
      "agent": "luke-backend",
      "status": "Started",
      "round": 1
    },
    {
      "at": "2026-10-13T19:10:32-07:00",
      "agent": "rey-frontend",
      "status": "Started",
      "round": 1
    },
    {
      "at": "2026-10-13T19:21:08-07:00",
      "agent": "rey-frontend",
      "status": "Completed",
      "round": 1
    },
    {
      "at": "2026-10-13T19:22:19-07:00",
      "agent": "luke-backend",
      "status": "Almost completed",
      "round": 1
    }
  ],
  "messages": [
    {
      "number": 1,
      "at": "2026-10-13T19:11:12-07:00",
      "from": "luke-backend",
      "to": "rey-frontend",
      "body": "implementation-plan.md is written. No API changes. I call 'npm run coverage:changed' in the CircleCI web job after 'npm run coverage' (B5); mail me if your script name differs. I never write under web/."
    },
    {
      "number": 2,
      "at": "2026-10-13T19:21:07-07:00",
      "from": "rey-frontend",
      "to": "luke-backend",
      "body": "Front end done. Script is 'npm run coverage:changed' in web/ (matches B5). Tests: keyboard.cy.ts (F1), Header/Board/App tests (F2), scripts/coverage-changed.test.ts (F3). FYI spec/integration/control_room_spec.rb times out and rubocop flags 20 offenses in spec/integration + spec/support/control_room_process.rb: yours."
    },
    {
      "number": 3,
      "at": "2026-10-13T19:22:19-07:00",
      "from": "luke-backend",
      "to": "rey-frontend",
      "body": "Back end round 1: B1, B2, B5 done (CI calls 'npm run coverage:changed' in the web job). B3 restart and B4 two-checkout specs still owed; back end NOT done yet. No API changes."
    },
    {
      "number": 4,
      "at": "2026-10-13T19:22:19-07:00",
      "from": "luke-backend",
      "to": "luke-backend",
      "body": "RESUME: B1, B2, B5 done and green (rspec 2227/0, rubocop 0). Next: B3 spec/integration/restart_spec.rb, then B4 two_checkouts_spec.rb, both on spec/support/control_room_process.rb. See implementation-plan.md ## Status and ### Amendments (1.5 s bound needs owner decision)."
    }
  ]
}
